user_id,raw_txt,txt_time,senti_value,label,dianzan,pinglun,zhuanfa
47,真的是十分无聊的每一天！！！ 广州 ,2020-10-16,-1.7165629764312005,1,0,1,0
290,早上看到一辆往地铁口运共享单车的大货，车身上写着几个大字：摩拜单车运维！ ,2020-10-16,2.86490784192406,0,1,21,0
356,对比了下 就蛮感慨的！ ,2020-10-16,0.4289936048244,0,0,0,0
71,#这是在干什么# ,2020-10-16,1.3591101616999999,0,7,6,0
390,我真的好喜欢扣嘴皮啊扣了涂唇膏 涂了又接着扣（桌面双煞） ,2020-10-16,3.59654065952,0,0,0,0
525,開始理解為何本專業有時會被列入STEM：凡是我學不懂的都被一棒子打成STEM。 ,2020-10-16,-0.4683396259132001,1,0,1,0
525,我是廢物我應該退學。不我應該去自殺。 ,2020-10-16,0.0,1,0,0,0
525,什麼時候我首頁能不再出現謝家初八？ ,2020-10-16,0.926047626372,0,0,12,0
419,你花錢給男明星 然後男明星不能談戀愛 他是鴨嗎 你是在嫖娼嗎 ,2020-10-16,1.0659805114365597,0,0,0,0
477,【江铃打造全新小号SUV车型】该车将拥有夸张的前脸造型……橄榄绿、黑色，黄色：除配备贴合使行李架外，黑色、新车尾部设计层次丰富！ ,2020-10-16,28.173698109102396,0,0,0,0
338,就不能早点做功课 非要熬夜 ,2020-10-16,-1.9241548350576,1,0,0,0
401,人的个性、性格几乎变不了，自己觉得舒适的区域，然后就会想方设法地逃到这个区域里，即使想要主观改变也没用。就像在湿冷的冬天，吃完饭就想躺进温暖的被窝里玩手机一样。让人沉溺。 ,2020-10-16,6.01731455599803,0,0,0,0
401,怎么好像刚把卫衣收拾起来了… ,2020-10-16,-3.36237827561,1,0,0,0
786,普通的那种“不普通”的人 ,2020-10-16,0.16768478010799992,0,157,29,4
242,危言危行🧡❤️💛 ,2020-10-16,0.0,1,0,2,0
640,床制品、靠垫、挂图等软件是最容易实现的设计。通过这些柔软的花草元素，增加房间里的“春”、“花香”的感觉。 ,2020-10-16,18.149926809735998,0,0,0,0
640,复古的房子和柜台无缘吗？答案当然是NO。即使是复古的房子套装，也可以做成带柜台的整体橱柜。我想时尚和古典音乐混合在一起。我有更多不同的兴趣。 ,2020-10-16,11.961230367892005,0,0,0,0
302,走一走 广州·广东药科大学大学城校区 ,2020-10-16,1.1478976312559999,0,4,1,0
503,有时决定了要走！——《闻香识女人》，走走停停地看看风景：没关系：有时决定留下。眼神却总望着远方的山水。一条路始终有个尽头……唱首歌、却总是徘徊留恋。 ,2020-10-16,10.2414936750065,0,0,0,0
677,被感冒环绕的十月 ,2020-10-16,-0.3140549155780001,1,0,0,0
715,阅读这件事本身的作用并不只是学术研究，也可以是一种单纯的欣赏品味 大连 ,2020-10-16,6.0995707145210005,0,1,3,0
888,今天上班上着突然就想到了这张照片这个动作想到了听风 ,2020-10-16,1.5772254771263998,0,0,0,0
888,开始日常咕噜咕噜整个部队火锅吃吃 ForestNaSen的微博视频 ,2020-10-16,2.7109287498159995,0,0,0,0
888,#肖战粉丝公益倡导# 摸鱼使我快乐适当的摸鱼总能不蜡笔 ,2020-10-16,15.212081362103,0,1,0,0
230,清朝第一位美女，她和温柔的母女都是佳人，历史上抗日型端庄善良，刚健豁达，她是一个勇敢、果断、有决断力和智慧的女人。她一辈子都受到温柔的影响，大哥温柔的照顾，还给予了爱，母女和睦相处。 丽水·外塆 ,2020-10-16,25.60915477038014,0,0,0,0
230,广东剧演员新华广东70多岁，老眼昏花，生计紧逼，上台表演，有一天，他在台上扮演将军，在两军交战中拿着枪杀敌，没想到一时间没看清，竟在京和北的由于向孙儿突击，场内大笑起来，发出嘘声，广东省知道了错误，立即按下枪信，“不行！”沙尘弥漫，杀死良民怎么办？ 丽水·格瑞斯影城(景宁店) ,2020-10-16,11.156494480432537,0,0,0,0
397,2020.10.16 ,2020-10-16,0.7573208305924,0,9,3,0
597,#运动打卡# 补打124，我昨天太困了，我今天太忙了，我都快到125大卡的时间，先默默的打上昨天的35min的腿部运动很酸爽，无法再吐槽keep简单了…分分钟的虐死我坚持直角肩打卡的又一天 ,2020-10-16,1.9919633676251,0,0,0,0
8,七七八八 ,2020-10-16,-1.16868142506,1,5,2,0
754,沙雕中间夹个美女不过分吧 ,2020-10-16,0.8326721727220001,0,67,13,0
754,困困的 ,2020-10-16,0.0,1,77,7,0
798,我为肖战超话贡献66影响力，超话目前在明星超话No.1！戳这里→网页链接 跟我一起助TA荣登超话封面吧~ ,2020-10-16,17.619893216311606,0,0,0,0
481,昨天和今天的颜值差，心情真的能影响颜值 ,2020-10-16,-2.5256840090519,1,0,2,0
481,只想躺在床上听歌 ,2020-10-16,-1.09661693533,1,0,0,0
481,有些事是真的担心不过来的 ,2020-10-16,-2.546285651723,1,0,0,0
536,睡在哪里都是睡在夜里。无眠，醒在何处都是醒在梦中。 平凉·菊苑小区 ,2020-10-16,-10.978564482934999,1,4,0,0
663,分享单曲 Blue ___. (@网易云音乐) 来听听语语子吧 ,2020-10-16,11.481643276389999,0,1,0,0
894,每天晚上躺在床上肚子咕咕叫但是并不饿 ,2020-10-16,-7.84454267739,1,2,2,0
370,想吃日新楼的小火锅，麻辣香锅，油泼面... ,2020-10-16,-1.1347171001002,1,0,4,0
370,但我没啥主见，过得也不好又错过一次抢捧花的机会 ,2020-10-16,-0.2158092664519997,1,0,1,0
35,不用盖被了 很暖和 ,2020-10-16,1.510248864557,0,0,0,0
900,给大家表演一个仙女出山 ,2020-10-16,4.2161135760300015,0,1,0,0
900,时隔一个月我也熬了夜况且明天还可以来个自然醒 ,2020-10-16,-3.7178882061582,1,0,0,0
735,是无法改变！人们都知道潘多拉魔盒带来的灾难和痛苦；这是每个女孩曾有过的！然后想做梵高、想知道过去的繁华与沦陷；活在自己世界里：却忘了盒底的希望；【英雄联盟之诅咒解说钻一打野瞎子详解上分经验】。#拔牙# ,2020-10-16,9.947129226080502,0,0,1,0
236,人生的第一意义是生活……人生的长河……才能寻找下一场爱情、也会有另一个人去负责填满！我们只是一粒粒尘埃、感情的世界里没有谁离开了谁就会活不下去。时间是最好的证明！ ,2020-10-16,7.4511331953042985,0,0,0,0
236,上长下短！小个子女生的显高法宝#新传考研##感恩母爱# 淮北·杨庄矿初级中学 ,2020-10-16,18.199178306058407,0,0,1,0
138,没有任何附加条件！现在我的心里充满了温暖、每天的心事、这些！帮我拨头发、难过时让我靠在他身上的人；喜欢[蕾伊] ,2020-10-16,6.210466766141199,0,0,0,0
931,第二名:天蝎座：你我很渺小。第三名狮子座！ 金华 ,2020-10-16,3.854283816405,0,0,0,0
748,不要遇到一点烦恼就觉得活；日子还那么长……静听我。静听彼此的澎湃···，静听你#宠物人口普查# 泰安·西关村 ,2020-10-16,8.11314021872165,0,0,1,0
62,不是吧，这也太美了 ,2020-10-16,0.0,1,7,4,0
612,7.江西婺源：该为自己的理想着想了。又是一年开头新的开始了；准备向理想前进；【最适合学生旅游的十大旅游地】1.四川九寨沟……主页君表示。6.海南三亚、10.陕西西安：3.云南大理！做好奋斗准备。#中国海洋大学# ,2020-10-16,29.666676460977488,0,0,1,0
612,真心拍的不错：“刚才俺哥骂了、我也不会骂人。“小叔快下来！小叔骂道：骂累了。就是战斗是时候都是在晚上#南京理工大学# 景德镇 ,2020-10-16,1.4870891671109998,0,0,1,0
661,草 真的心痛 也是真的会流眼泪 ,2020-10-16,-4.648417811010001,1,0,1,0
661,吗比的 这什么几把封面，，笑屎我惹 ,2020-10-16,-0.09876707105000017,1,8,13,0
661,草他娘的，，，疫情是不是会再次爆发啊，，我感觉现在降温降得好快 比去年快多了 ,2020-10-16,-4.889109488827001,1,1,3,0
661,还是豪总牛。男女通吃 ,2020-10-16,0.0,1,4,17,0
661,双人能不能安安静静双了滚蛋，，，私信挺招人膈应的，也不想听到什么感谢遇见追星愉快的屁话，， ,2020-10-16,7.215181025107004,0,2,1,0
661,救命 爱豆谈恋爱就是偶像失格 觉得爱豆谈恋爱没什么的双我行不行，，，我真服了 ,2020-10-16,-4.6863262496564015,1,3,12,0
661,打工人在路上超话 早安，打工人！ ,2020-10-16,2.2589337574879,0,1,0,0
642,今天的快乐又是钟老师给的 ,2020-10-16,5.397343307991,0,4,0,0
18,真的不想任何熟人知道我的微博id，也不知道为什么，可能是让心里这些小秘密无处安放了吧 ,2020-10-16,-1.1440610621693004,1,5,0,0
586,怎么不会开心呢 ,2020-10-16,2.61234173173,0,0,0,0
904,五节课两场会的一天 ,2020-10-16,-0.8238417322011999,1,0,0,0
904,中午开会 我花七分钟飞到学校最远的口腔系楼 这学校这么点大足够了 ,2020-10-16,-3.781438541144,1,0,0,0
904,我真他妈直呼内行 ,2020-10-16,0.864925478527,0,0,0,0
904,现在我一餐吃十二块了 好贵[悲傷] ,2020-10-16,-0.8911498000329999,1,0,0,0
