user_id,raw_txt,txt_time,senti_value,label,dianzan,pinglun,zhuanfa
290,大风中的奥森 ,2020-11-07,1.1092671912899998,0,7,4,0
290,有一次数学考试，题目是“东方明珠广播电视塔高：468（ ）”齐齐填的是“厘米”，他一个女同学看后大喊道：这是广播电视塔啊！塔！塔！塔！ ,2020-11-07,11.085233678085599,0,0,2,0
845,能在浪费时间中获得快乐 就不算浪费时间 ,2020-11-07,4.528125482908,0,1,1,0
205,Life In A Beautiful Light-Amy Macdonald、简单得不能再简单的元素、AmyMacdonald新专辑《LifeInABeautifulLight》一笔零用钱一张CD一把吉他；作为学渣协会终身名誉会员…… ,2020-11-07,20.892757433789004,0,0,0,0
356,小张就是舞台下再多不自信和犹豫到了台上都会大方自信展现自己的光亮、精准捕捉镜头的人诶～ 吳吉安Wu的微博视频 ,2020-11-07,17.288397726357,0,0,0,0
6,🧃吧唧吧唧 想吃记录贴： ,2020-11-07,-1.877809877892,1,6,12,0
20,努力训练！#金州勇士# ,2020-11-07,4.8432936004360005,0,215,20,15
20,啊———— ,2020-11-07,6.387383829480001,0,63,9,4
71,最近连轴转的工作，也累，也烦，也好久没回家了，我好想小七啊，这个世界上除了家人和好朋友，就只有小七的喵喵叫能抓痒我的心了。 ,2020-11-07,-0.95710869832215,1,24,0,0
390,这天冷的我觉得我的美貌都能保鲜了 ,2020-11-07,-0.4479165673560005,1,2,2,0
218,芃芃其麦超话如果烂节目不能改邪归正，那就糊到底 金华·清明上河图景区 ,2020-11-07,-0.6450848952840004,1,1,0,0
218,芃芃其麦超话超越公司以后选节目慎重，烂导演的不要接 金华·清明上河图景区 ,2020-11-07,6.3868733285889006,0,0,0,0
218,芃芃其麦超话喜欢超越就足够了，对小人远离 金华·清明上河图景区 ,2020-11-07,8.809023096520999,0,0,0,0
218,芃芃其麦超话如果破节目对超越还不好，放弃不看 金华·清明上河图景区 ,2020-11-07,2.1280938114840002,0,0,0,0
218,芃芃其麦超话超越太善良了，有些人就是狼狈 金华·清明上河图景区 ,2020-11-07,4.265718185745,0,0,0,0
218,芃芃其麦超话时至今日还有人想针对超越 金华·清明上河图景区 ,2020-11-07,4.94495038349645,0,0,0,0
218,芃芃其麦超话看完这低水准的综艺，心里憋屈 金华·清明上河图景区 ,2020-11-07,5.191593323159999,0,0,0,0
218,芃芃其麦超话只想蹭超越的热度，又对超越不好 金华·清明上河图景区 ,2020-11-07,3.5607491897429995,0,0,0,0
218,芃芃其麦超话从来没有看过一个综艺这样冷落超越 金华·清明上河图景区 ,2020-11-07,5.070317353035,0,0,0,0
218,芃芃其麦超话对超越不好的综艺以后尽量避开 金华·清明上河图景区 ,2020-11-07,4.415306768444,0,0,0,0
477,看好一件事、看明一件事；你就长大了！看破一件事、你就开窍了、你就成熟了，你就流泪了，看清一件事！你就理性了。#收纳# 日照·济南夜沙龙烧烤岚山旗舰店 ,2020-11-07,18.655980408292,0,0,1,0
786,这是我独立生活后的第一个秋天👕：@OURDAILYDOSE ,2020-11-07,4.310667033954,0,94,32,5
376,到了适婚的年龄的人会觉得《适婚的年龄》越听越好听 ,2020-11-07,0.7136175248414001,0,3,0,0
795,当矛盾无法调和，我主张死杠到底。就算不是你死我亡，也要两败俱伤。生而为人，不要惹事，但也不要怕事。当然能调和最好大家都可以多活几年。 瑞安市 ,2020-11-07,-2.9868885779134,1,0,0,0
640,小编的话：狭长的房间经过合理的设计，没有拥挤感。开窗使书房明亮饱满，阳光可以毫不犹豫地温暖你的书。 ,2020-11-07,13.779595684245999,0,0,0,0
640,阳台也能是会客的场所，在晴朗舒适的天气中，将客人们带领到阳台中闲聊，不一样感受，会客时气氛更加的轻松融洽。 潍坊·五井全羊府 ,2020-11-07,19.2407166599784,0,0,0,0
115, ,2020-11-07,0.0,1,0,0,0
302,只想躺着 海口 ,2020-11-07,-0.8111845217459999,1,4,8,0
503,美女脸红了；于是大声喊道；“我很喜欢你、一美女无聊！”这时很多同事看着他们俩个……“我喜欢你；于是这事就成了……小伙子脸更红了……心想公司里有没有人暗恋自己。 眉山·岷江村 ,2020-11-07,1.9129171275112,0,0,0,0
503,你才正式成为无辜爱情的受害者，就这样……我缺你#新娘造型# 眉山·南桥坝 ,2020-11-07,7.497317203336999,0,0,1,0
436,每次这种时候就觉得，真好，还有人跟我一样没睡。 ,2020-11-07,-1.02376523509,1,1,2,0
677,☕️ ,2020-11-07,0.0,1,6,2,0
671,否定一件事情太容易了 而想发掘真相就要付出百倍努力 ,2020-11-07,2.8989399816748005,0,1,1,0
888,啊我晕了芝士丸的芝士煮得流出来了 ,2020-11-07,-0.3625297094929997,1,0,0,0
888,我也不懂自己之前同一张手幅印那么多干嘛还有几十张我累了也懒得带去发 ,2020-11-07,0.7819836758440001,0,0,0,0
888,包快递好累包了俩我就整不动了 ,2020-11-07,1.497099317599,0,0,2,0
692,科目二终于考过了 花了好多好多冤枉钱 委屈死了 ,2020-11-07,-1.7434116417760002,1,1,0,0
230,1920年9月4日，刘半农写了一首诗，题为《我怎能不想起她》。标题中的“她”一词最早是刘半农创造的，这在历史上的汉语文本中是找不到的“她”具有重要的意义，因为它不仅对白话文的推广起到了重要的作用，而且赋予了中国女性在文本中独特的地位！ ,2020-11-07,22.63085980084001,0,0,0,0
446,相互不说话的日子你在干嘛 ,2020-11-07,0.10125109258979996,0,3,2,0
397,狗狗有让人开心的魔力！！！！ ,2020-11-07,4.11849770276,0,15,6,0
597,#运动打卡# 140天…今天是盖楼输了的女孩被吊打一般强度的健身，已经没那么严格的控制晚上饮食了直角肩是要一直做下去的直角肩 ,2020-11-07,-2.4787360774817997,1,0,0,0
841,还真不是个简单事、家务达人郭品捷又上场了!好轻松：平时一个人套上、苦恼已久的麻烦事儿就交给《好好生活》吧……《好好生活》今晚7:30看点新爆点。好优雅！让你只用20秒套好双人被套，不得不学哦、被套是个大家伙 ,2020-11-07,19.346128290620197,0,0,0,0
841,又打不过他们！怕老头是骗子输棋赖账不给钱，在桥头看到了一副象棋残棋！但是。搞个三五百是没问题的、下次兄弟们求组队啊。专搞残棋；只走三步棋，哥就可以把那老头给将死[BB8]#博美# 铁岭·绿景豪庭 ,2020-11-07,5.8445291740644025,0,0,1,0
499,跟随本心是病态化的 自由在异化中发酵. ,2020-11-07,-2.2624366192675995,1,1,0,0
754,现在plog拼着拼着就变成恋爱plog了 ,2020-11-07,-0.3924536653860001,1,108,12,1
798,我为肖战超话贡献66影响力，超话目前在明星超话No.1！戳这里→网页链接 跟我一起助TA荣登超话封面吧~ ,2020-11-07,17.619893216311606,0,0,0,0
409,今天扮演的是龍女哈!!!🐲📿🀄️ China Girl (Single Version1990 Remaster) ,2020-11-07,10.439454678926001,0,5,8,0
951,取向狙击 ,2020-11-07,0.1882605156092,0,7,9,0
481,好像谈恋爱，然后一起出去旅游，共同打造未来，会有这样的事吗。 ,2020-11-07,7.4762369184069986,0,0,2,0
481,太难受了，每年做完皮试都肿的不行，不能沾水，还要去拍胸片，明明没什么问题，却要白遭这份罪。 ,2020-11-07,-9.557461960622598,1,0,0,0
746,#立冬# ,2020-11-07,3.974555755,0,5,1,0
255,#天猫双11#快来抢啦~我刚刚参与抽中了现金红包0.5元，我的朋友们必须知道！快冲！双11精彩资讯﻿ ,2020-11-07,16.657918684225994,0,0,0,0
255,#天猫双11#快来抢啦~我刚刚参与抽中了现金红包0.5元，我的朋友们必须知道！快冲！双11精彩资讯﻿ ,2020-11-07,16.657918684225994,0,0,0,0
255,#天猫双11#快来抢啦~我刚刚参与抽中了现金红包0.2元，我的朋友们必须知道！快冲！双11精彩资讯﻿ ,2020-11-07,16.278881652937,0,0,0,0
255,#天猫双11#快来抢啦~我刚刚参与抽中了现金红包0.2元，我的朋友们必须知道！快冲！双11精彩资讯﻿ ,2020-11-07,16.278881652937,0,0,0,0
255,#天猫双11#快来抢啦~我刚刚参与抽中了现金红包1元，我的朋友们必须知道！快冲！双11精彩资讯﻿ ,2020-11-07,16.910136660461,0,0,1,0
59,好看的不一定好吃 好吃的不一定好看🤲🏼 ,2020-11-07,6.155377796739999,0,1,0,0
114,怎么才能让自己快速的平静下来  太难过了 做人好难太难了  下辈子要做只猫 ,2020-11-07,0.6565179383303997,0,5,2,0
646,今晚是😽 ,2020-11-07,0.24442204003600002,0,0,0,0
646,我甘愿去丛林深处甘愿去辟谷 去守护无人的蓝色小岛 拙劣的清洗 生根发芽 即使反反复复的跌落 永无止尽的词不达意   回看的是一步步稳定地基 高频甘愿去往所有的情绪深渊去换来平静的框架外部 ,2020-11-07,9.820279275805003,0,1,2,1
370,分享Roo Panes的单曲《My Sweet Refuge》网页链接 (@网易云音乐) ,2020-11-07,16.096057167930002,0,1,0,0
900,翻了相册里所有的照片很想念过去～想念在723的每一天～想念尼姑庵的女主人们  也倍加珍惜和陈sir在一起的每一分～温暖且有趣一个月内两次奔赴保定，总是觉得熟悉熟悉又陌生，逛了经常逛的商场，去了想去的地方，孤独感让我不敢久留，真的是越长大越孤单，也偶尔享受独处的快乐现在的上班生活充实但时常抱怨负能量乱糟糟～理想总是距离现实很远半年的经历让我不断成长迷茫中前进 邯郸·馆陶县 从前慢wyx的微博视频,2020-11-07,33.190618834851605,0,4,2,0
735,一起来感受下吧；你怎么舍得我难过。“最爱你的人是我，你却没有感动过...”别让珍惜自己的人难过，刘德华的一首《你怎么舍得我难过》；~！ 萍乡·龙园主题宾馆 ,2020-11-07,-0.20833528567399928,1,0,0,0
236,你如此虚伪；据说现在新生的军训俯卧撑都流行这样训练了、无所谓了！我何必在意 ,2020-11-07,0.06775471323159972,0,0,0,0
216,不爱不恋不动心。做一个恶的善人……“太善良；太现实。”；得不到幸福；善做本。体会不到幸福、做一个陌生的熟人！ 金华·磐安县 ,2020-11-07,3.2415367808902005,0,0,0,0
138,短裤借用腰带塑身形体，记住；女孩……而是把你当公主的人……#微信表情包# 三门峡·新华书店(卢氏县妇幼保健院南) ,2020-11-07,14.360539233888,0,0,1,0
931,整天在亏钱：打算要裁员。公司效益不好#留学##我们恋爱吧# 嘉兴 ,2020-11-07,-6.187880851803,1,0,1,0
473,#记录人间疾苦# 一想到东北就是舔大门吧？ ,2020-11-07,4.7446961064535,0,5,11,0
748,你可以再等，错过了一个人却是永远都等不到了：但有时候。错过一列班车#新车上市# ,2020-11-07,4.1981030920740015,0,0,1,0
748,我每天重新打造一条秘密小路，我无法跨越失落的那一段……在蜿蜒奇诡的归途中尽情冒险；回家的路回家唯一的路：被昨夜粗心的流星撞落了，还好天使还在；还好月亮还在。还好想像还在 泰安·杨家村 ,2020-11-07,6.9560153028405285,0,0,0,0
612,去过西藏的童鞋来看看自己当时漏了什么高原反应要注意的事项：做我男朋友吧。进藏要准备的东西都有……于是跑去搭讪，一日！#伊能静# ,2020-11-07,5.383706793041141,0,0,0,0
661,我好喜欢这张噢！ ,2020-11-07,3.51103464635,0,0,4,0
87,我真的想你 真的喜欢你 也真的不敢告诉你 ,2020-11-07,-2.8570744356350004,1,1,0,0
21,陈凯歌导演真的好好啊，实在太期待以后能有机会听他讲讲我的小宝了。真的有一两拨千斤的感觉。（还有就是导演亲口说他喜欢有牛劲的演员，众所周知我家有位牛塑达人... ,2020-11-07,4.9403790228698,0,0,1,1
21,如果有一个赞，我就点份外卖。 ,2020-11-07,2.731288729370001,0,12,7,0
18,冬天来了就不要去想秋天的不开心啦 ,2020-11-07,2.8387271974647,0,5,0,0
268,小武的CC修复资源（应该是线上某个影展的）都流出来了，CC官网上竟然没有一点要卖碟的意思？🤔 ,2020-11-07,7.4962606467329955,0,1,1,0
72,“一辈子很短  如果不小心遇到错的人  一定要学会适可而止” ,2020-11-07,-0.16491629685139986,1,0,0,0
904,我可以靠麻酱度过余生 ,2020-11-07,1.887091690244,0,0,2,0
904,学了医后就肆无忌惮地在数学上懈怠 ,2020-11-07,-0.34841460977500005,1,0,0,0
862,【成年男女之间到底有没有纯友谊】1、许多人都有一个红颜、蓝颜知己。2、成年男女之间的友谊在日久相处之后，很容易生出暧昧的情愫。3、这种不健康的情愫如果不加以控制，便会升级为出轨，进而伤害双方家庭。4、如何避免这种情况发生呢？5、答案是“高纬”控制。“高纬”是相对“低维”来说的。高纬就是信仰（宗教、道德）层面的培养、克制（低纬就是交往方式的控制，比如少见面、公共场合见面、少挑逗等）。,2020-11-07,22.4195472466667,0,11,17,8
588,这一段真的太刺激了，点目时甚至看出了科幻小说与古文明遗址交互的磅礴寂寥感 ,2020-11-07,2.0217432740851997,0,0,0,0
449,#肖战#今天吃了饺子，喝了小鹿茶 ,2020-11-07,5.287792287793,0,0,0,0
449,我刚刚在#星光大赏# 为 @X玖少年团肖战DAYTOY  贡献星光，一起@腾讯视频 送我去现场为爱豆打call！ 星光大赏星光能量榜 ,2020-11-07,21.756452139468998,0,0,1,0
