user_id,raw_txt,txt_time,senti_value,label,dianzan,pinglun,zhuanfa
47,十月四日撞个正着，你的脸比喝醉酒还要红！ ,2020-10-04,0.4851680281418001,0,0,0,0
47,#带着微博去旅行# 冒泡 惠州·南昆山国家森林公园 龍培莲的微博视频 ,2020-10-04,6.256701539380001,0,0,1,0
47,好治愈啊～#溜走的夏天#惠州·南昆山丹枫寨 微博视频 ,2020-10-04,6.713578613192,0,0,0,0
47,🌄 惠州·三寨谷 ,2020-10-04,0.6918626053770001,0,0,0,0
290,北宫国家森林公园里的迪士尼乐园 ,2020-10-04,3.702953393138,0,0,2,0
290,看到了古天乐的签名 ,2020-10-04,1.4622741205819,0,3,0,0
205,"就简单了，就复杂了、复杂的事！看淡了；“那转过去让我看看你有没有男朋友”：Thesimplethings,likedeep,complex.Complexthings,bearish,simple.——简单的事！想深了 烟台·管家(河滨路店) ",2020-10-04,11.862964939271741,0,0,0,0
131,你打了个喷嚏是我在想你💒💕 ,2020-10-04,-3.738458987291,1,1,3,0
912,毛的歌总能给人一种像在哪里听过的熟悉感，明明是首新歌，却唱出了经典的，隽永的感觉。这大概是让人对他无法自拔的原因吧。 ,2020-10-04,2.643702709548001,0,0,0,0
525,旬刀和大马士革刀真好看，等俺有钱了也整两把。 ,2020-10-04,1.5957206156099997,0,0,0,0
525,你彻彻底底让我失望了。 ,2020-10-04,-1.30797290855,1,0,1,0
525,我知道你们都讨厌我，都恨我，没关系，我一点意见都没有，但是能不能求求你们放过我？我已经挺可怜的了。 ,2020-10-04,-10.474533772675002,1,0,3,0
525,想明白了，我是人中比格，地狱恶犬。 ,2020-10-04,-0.1796407518880001,1,0,4,0
525,网红打卡四个字就足够让我大口吞噬氯雷他定了，能不能放过我 ,2020-10-04,0.4231484191239998,0,6,0,0
525,本来说不想骂也不想关心，但是看到这些还是很难不笑出声来。 ,2020-10-04,-1.9020748956581,1,0,0,0
525,好大一朵冰清玉洁的天山雪莲，得招来一百单八个周敦颐在你楼下齐颂《爱莲说》吧？ ,2020-10-04,1.06546748803,0,0,0,0
525,腆着脸说什么喜欢呐。 ,2020-10-04,-0.3354828761959999,1,0,0,0
525,@威尼斯代购老王 被我拿捏。 ,2020-10-04,4.666100706814,0,1,2,0
160,第七届#中国电视好演员#投票通道开启，快来为你心中的好演员投出神圣的一票吧！关注@微博电视剧 @中国电视好演员奖 了解更多活动资讯~ 第七届中国电视好演员网剧组投票通道 ,2020-10-04,31.434155756569904,0,0,0,0
160,第七届#中国电视好演员#投票通道开启，快来为你心中的好演员投出神圣的一票吧！关注@微博电视剧 @中国电视好演员奖 了解更多活动资讯~第七届中国电视好演员网剧组投票通道 ,2020-10-04,31.434155756569904,0,0,0,0
401,荣成新闻，还弄个“上级媒体关注荣成新闻” ,2020-10-04,3.2202074594602,0,0,0,0
640,这个电视背景墙采用了中国国画的表现手法，暗香浮动的梅花和翻飞蝴蝶，构成一幅清新脱俗的画面，提升了整个客厅的品味。一旁紫色的沙发和花朵的色彩也相互呼应。 ,2020-10-04,25.98410937994101,0,0,0,0
640,木元素总能给人带来放松的感觉。这间卧室整面墙和屋顶用桑拿板包裹，让您感到轻松舒适。 ,2020-10-04,11.602321563456199,0,0,0,0
640,落地窗的设计使餐厅空间明亮宽敞。黑色实木餐桌与白色、金色餐椅相配，个性十足。它强化了餐厅空间的视觉效果。角落里的绿色植物和墙上的装饰为空间注入了自然气息。 东莞·广发金融大厦 ,2020-10-04,30.275948419240013,0,0,0,0
503,成功并不能用一个人到达什么地位来衡量……（布克.华盛顿）：而是依据他在迈向成功的过程中！到底克服了多少困难和障碍 眉山·彭山第一实验学校 ,2020-10-04,13.115479885933395,0,0,0,0
436,多总舔他香香jio ,2020-10-04,2.010571195477,0,3,2,0
715,给教研组准备的中秋礼物 袋子好好看 好利来走心了 大连·金石滩 ,2020-10-04,3.887007493944002,0,0,0,0
671,优衣库是觉得女生的脖子都比男生的长吗还是男生真的都不穿高领 ,2020-10-04,1.3118536149297504,0,0,0,0
671,国庆假真好啊 好久好在我已经四天都是将近三点还没睡了 ,2020-10-04,-6.968578835387,1,0,4,0
581,你就是个大傻逼 你今天不能不开心 微博视频 ,2020-10-04,1.170689340438,0,2,2,0
581,有得必有失 有失未必有得 ,2020-10-04,-0.05422179869100008,1,1,1,0
581,注重细节的人可以加好多好多分 ,2020-10-04,3.2547940963169997,0,0,0,0
888,害那个怕紧那个张继续通宵希望明早不会错过1005 ,2020-10-04,-1.4897391912979996,1,0,4,0
888,窗外在放烟花热闹与我无关 ,2020-10-04,1.3636156914107,0,0,0,0
888,下午才发现我剪了三分之一而不是五分之一突然快乐开始耍废 ,2020-10-04,-2.5416859910799996,1,0,0,0
888,为什么我每次国庆坐公交都能遇到学校返校啊 ,2020-10-04,-4.199434982444201,1,0,0,0
888,车来的前一秒切换到了 ,2020-10-04,-0.2566299047335,1,7,0,0
627,大部分人都具有可替代性 ,2020-10-04,2.5008455353169,0,2,2,0
397,属性如图[手套] 🧡备注TT/车车💛发博不多但i互动🧡自来熟 介意我就少说话！ ,2020-10-04,7.436659174669003,0,11,3,0
597,关于我为什么今晚不好好减肥 ,2020-10-04,0.852551061664,0,0,0,0
867,钟敏今天由于没有睡午觉。早早的上了床躺着。刷着抖音渐渐的困意来袭。我就拿着手机睡着了，就是手里手机还在播放，眼睛已经闭上辣种。然后。被吴蓉看到了，她笑得好大声把我吵醒了钟敏虚荣心作祟，假装把手机丢了。但是我现在是真的睡不着了。但是吴蓉现在已经睡了。完了真的完蛋了我太难过了昨天我和梦格他们打牌，当了一晚上农民我太惨了我好难过 有一说一，大家难道不会玩着玩着手机就睡着我？难道只有我一个人是这样吗,2020-10-04,-35.97003849440714,1,1,3,0
754,我讨厌长途一辈子[暈] 阿勒泰地区·布尔津县 ,2020-10-04,-2.459572503059,1,67,7,0
754,开学倒计时🥺🍋 ,2020-10-04,-0.23886696285,1,112,11,0
798,我为肖战超话贡献66影响力，超话目前在明星超话No.1！戳这里→网页链接 跟我一起助TA荣登超话封面吧~ ,2020-10-04,17.619893216311606,0,0,0,0
798,肖战最好的你超话#肖战1005生日快乐# #肖战我喜欢你# 10.04生日倒计时，在线互我已经开始激动了，心跳的好快啊，手脚忙乱不知道该干啥了都，好没出息啊@X玖少年团肖战DAYTOY ,2020-10-04,16.071749780791993,0,1,21,0
409,愿我们都能充盈感知自己的价值 也无惧成为别人的烛光🕯️ ,2020-10-04,12.21094545934,0,0,0,0
267,可能性中的投影@四方当代美术馆 #今晚一定要梦到这蓝色# 南京·四方当代美术馆 ,2020-10-04,12.879454205265999,0,2,0,0
199,肖战最好的你超话#肖战1005生日快乐#  xz  #肖战平安喜乐# 用温柔收服匕首，拿火把点燃宇宙，不问风的方向，脚步比星星滚烫。 未来比故事要长，像你许诺的那样@X玖少年团肖战DAYTOY ,2020-10-04,24.926494862160496,0,0,36,0
199,"我为@X玖少年团肖战DAYTOY  贡献星光，疯狂艾特@腾讯视频,快送我去#星光大赏# 现场为爱豆打call！ 星光大赏星光能量榜 ",2020-10-04,22.827719633396,0,0,0,0
199,我刚刚在#星光大赏# 为 @X玖少年团肖战DAYTOY  贡献星光，一起@腾讯视频 送我去现场为爱豆打call！ 星光大赏星光能量榜 ,2020-10-04,21.756452139468998,0,0,0,0
199,"我为@X玖少年团肖战DAYTOY  贡献星光，疯狂艾特@腾讯视频,快送我去#星光大赏# 现场为爱豆打call！ 星光大赏星光能量榜 ",2020-10-04,22.827719633396,0,0,0,0
481,美女梳头 微博视频 ,2020-10-04,3.0432832705950004,0,0,2,0
481,我梦见我跟capper搞暧昧了 ,2020-10-04,-2.7458409129815,1,0,0,0
481,我的便秘药是过期的，我的风油精是过期的，我都照用了，因为我根本没发现，别人告诉我的…… ,2020-10-04,-6.5771660419848,1,0,0,0
123,贤者时间到，最近意料中的大笔开支已经完结，来复盘一下。【成都行】1.去看了凡凡，下车就是一个好大的拥抱，哈，果然是热情的人，虽然多年未见（搬起手指姆算，是有个六年没见了），但还是那么得，恍如十年前初识。三天一起吃了好多顿饭，每次我明明饭前都想着念着，要记得抢单要记得抢单，饭后却总 ...全文,2020-10-04,16.47189373673094,0,1,3,1
59,太呀噻了 撑目看完 波波波buckoo的微博视频 ,2020-10-04,1.225432023552,0,0,0,0
749, ,2020-10-04,0.0,1,3,0,0
370,秘密森林2编剧真的够沉得住气，一直铺垫到第13集结尾才把支线联系起来。裴斗娜女士真的是衣服架子，穿啥都好看。 ,2020-10-04,4.539781125992199,0,2,0,0
217,就是仓库的环境稍微差点 孙浩楠Evan的微博视频 ,2020-10-04,0.980688540024,0,0,0,0
482,订婚快乐 吃好喝好 ,2020-10-04,5.2890227246300014,0,25,1,0
900,Is a 头绳？ ,2020-10-04,2.2599676952300003,0,1,0,0
900,烟味儿让人窒息 ,2020-10-04,-2.43130571485,1,1,4,0
735,不过要注意的是；卸妆水相对来说卸一些细节更方便，少數人和個別人的：我們可以不欣賞。不喜歡他們的風格……#求生欲# ,2020-10-04,6.393713121564,0,0,0,0
236,"恐轨车站挑战模式视频！一可的魔兽世界教室。如果沉默是一种伤害，请选择谎言……如果谎言是一种伤害：Iffaithisaninjury,choosealie;ifthelieisaninjury,pleasechoosesilence;silenceisaninjury,pleaseleave.如果真诚是一种伤害。 ",2020-10-04,4.577054699222799,0,0,0,0
236,质地很好！一只金毛在公园里耍得不想回家……我自己留了白色的。 合肥·白水坝 ,2020-10-04,5.5396737763270005,0,0,0,0
300,努力成为一个很哇塞的女孩，心情很哇塞，气质很哇塞，身材很哇塞，生活也很哇塞 ,2020-10-04,15.957222103666101,0,1,2,0
661,所以谁能告诉我67为什么jh ,2020-10-04,0.7219118543809999,0,1,5,0
661,心有余而力不足，，我的gct怎么没了🆘 ,2020-10-04,0.0,1,0,2,0
661,互动一下朋友们 我的耗又不行了 ,2020-10-04,1.0532998889430003,0,6,45,0
661,啷个回事 怎么这么多人kg ,2020-10-04,-1.7134186841312,1,0,2,0
661,怎么硕呢 他喜欢就行 我无权干涉 ,2020-10-04,1.3189044909729997,0,9,4,0
661,雄鹰高飞忠实信徒超话怎么硕呢 ,2020-10-04,6.479215453176,0,0,0,0
661,今天已经四号了 摇真的快要解散了 我怎么还是觉得好不真实啊… ,2020-10-04,-5.527843470606,1,7,4,0
21,我不骂人，因为今天我的人设是性感甜唯。看我的好身材！赵小棠@THE9-赵小棠 你学着点。 ,2020-10-04,7.318646552629,0,2,3,0
13,我大姨是我最希望成长为的那种长辈，将近六十岁了也依然是小女孩。总是真诚地夸赞我大姨夫；记得每个人的喜好，体己不敷衍；和陌生人相处简直有魔法，一种水汪汪的热络。即使是最窘迫的日子也从未抱怨过，总是感激一切，是那种真正把自己浸入生活当作人生体验的人。她让我明白人可以永远有不狡黠的天真，幸福也可以是痛痛的。,2020-10-04,17.9559166031653,0,2,0,0
904,爹说什么新家装八千块的洗碗机 三千块的马桶 我想想我的塑料饭盒和蹲式厕所 想家了 ,2020-10-04,-4.4066532463275,1,0,0,0
904,今天也是为学/分和志/愿者小/时数拼命的一天 而且今天班会推迟没选班委 ,2020-10-04,-1.7305003358045,1,0,0,0
904,他妈的 经历过二轮面试 我的想法就是千万别选我！ ,2020-10-04,1.6657774366130007,0,0,0,0
904,我用ipad的时候 耳机联到手机 用手机的时候 耳机连到ipad 有完没完 ,2020-10-04,-4.884554205663999,1,0,0,0
916,#2020金鹰女神投票# 我在 @第13届金鹰节开幕式晚会 金鹰女神助飞榜为女神候选人助飞，快来给你喜欢的候选人送出助飞值吧！#微博陪你看金鹰# 第13届金鹰女神·助飞榜 ,2020-10-04,28.2622231643,0,0,0,0
588,他会喜欢艾略特和保罗策兰我一点也不意外诶，反倒是海子，虽然不是第一次知道，还是觉得很神奇。他一定有个非常好的中学语文老师 ,2020-10-04,4.2350098982699995,0,0,0,0
637,记录我平凡，倔强，的，生活 ,2020-10-04,4.222633431995,0,0,0,0
449,我刚刚在#星光大赏# 为 @X玖少年团肖战DAYTOY  贡献星光，一起@腾讯视频 送我去现场为爱豆打call！ 星光大赏星光能量榜 ,2020-10-04,21.756452139468998,0,0,1,0
