user_id,raw_txt,txt_time,senti_value,label,dianzan,pinglun,zhuanfa
845,推荐你来#唱吧#听刘潮阳唱的这首#天外来物|玩音乐，就上唱吧(@唱吧)！天外来物-刘潮阳 ,2020-11-18,19.172279339106428,0,0,0,0
205,就是离开、”——单是读着都觉得温暖、你同时也正在离开你的父母：良缘永结、载明鸳谱！此证……#北京婚礼策划# ,2020-11-18,10.605673169429,0,0,1,0
205,不是看破！曾经看不惯。成熟：受不了的，如今不过淡然一笑、而是看淡#杭州美景# ,2020-11-18,4.2006998626251,0,0,1,0
71,cut3 ,2020-11-18,0.0,1,34,0,0
71,cut2 ,2020-11-18,0.0,1,14,0,0
71,cut ,2020-11-18,-0.288198636273,1,43,6,0
108,只需给自己做的事一个有使命感的理由，便会从无聊转化为意义，瞬间的事儿，一念的事儿. ,2020-11-18,4.2544526936818,0,0,0,0
108,文字的表达方式不同，对大脑神经元的传递方式也会不同。例如这样的表达：落雨（下雨）、主理人（个体户）……，一时想不起太多.它会立刻改变对一件事物或人的本质印象，但其实都是一个本质。 不只是文字，其他很多很多事情都可以同理类比，一眼看不穿本质的人，都是被算法宰割的对象. ,2020-11-18,11.807868096126196,0,0,0,0
108,刚看到一个清华博士up主，baby不到一岁，她说特别不愿意每天拍视频，除非是只拍自己愿意的，但是为了粉丝流量又不得已没办法，她对朋友说已经很久没快乐了. ,2020-11-18,7.766152870161298,0,0,0,0
108,可以用心感知到世界的深刻结构，如我们所知，时间不再存在——就像山上的傻瓜看到日落时发现地球在转动，而我们开始发现我们就是时间。我们就是这个空间，这个在神经元连接里由记忆的痕迹开启的空地。我们是记忆，我们怀旧，我们期许着不会到来的未来。由记忆与预期开启的空地就是时间. ,2020-11-18,20.033130002892296,0,0,0,0
626,下班🥸 ,2020-11-18,-0.733639317093,1,5,7,0
170,🌆 ,2020-11-18,0.0,1,5,2,0
525,我這個逼人怎麼一天到晚那麼多想罵的。 ,2020-11-18,-4.923598001041,1,1,10,0
525,@呵不出來 是臭豬還是香豬就取決於是不是真的去睡了！ ,2020-11-18,-1.3649537695200002,1,0,2,0
2,记录一段秘密的【摩斯密码】收工#重庆纹身# ,2020-11-18,10.469263225594002,0,0,1,0
477,都会想起一些人！--《匆匆那年》；回忆起匆匆那年……每个人回忆起青春 日照·岚山区老干部活动中心 ,2020-11-18,7.4190621464416,0,0,0,0
510,北方下雪了听说南方却出了一整天汗 ,2020-11-18,-1.9461219750046,1,0,0,0
510,希望我们走过一段就有一段的快乐 —— 说起来 哪有永远不变的航道呢 ,2020-11-18,12.065851179649002,0,0,0,0
570,摄影超话 我听到13岁的她说“班若虽美，终究是鬼” 重庆·重庆医科大学 ,2020-11-18,3.0459662404839998,0,6,1,0
136,叶泽超话 打工人爱情故事上 ,2020-11-18,-0.18439170991300002,1,10,11,2
524,我再也不想买帽子了（才怪 ,2020-11-18,-0.978633602927,1,32,20,0
524,？ 微博视频 ,2020-11-18,1.247771783344,0,9,10,0
640,贵妃榻是淡咖色，上面的软包设计是浓浓浅浅的棕色，棕色墙面跟咖啡色床搭配起来，原木系的地板让室内暖意爆棚。#诗情画意新中式##生活小技巧# 东莞·麦当劳(得来速餐厅) ,2020-11-18,29.8402439614288,0,1,0,0
302,突然有一种想健身的冲动 ,2020-11-18,-2.520218795047,1,1,12,0
285,一波养眼的复古英伦风鞋子 深圳 ,2020-11-18,10.346955412642133,0,0,0,0
743,一不小心发早了，年更音乐人发歌啦～感谢一糖的邀请，编曲我很喜欢，请欣赏。OneCandy/Aou/ClearYxY/汪川《只对你倾心（Feat.汪川）》只对你倾心（Feat.汪川）（@网易云音乐） ,2020-11-18,29.244292869121804,0,14,7,1
677,想吃心冻角[悲傷] ,2020-11-18,1.4343857308890002,0,0,5,0
703,全世界都给我去死 ,2020-11-18,-0.7227281198659999,1,0,0,0
671,在十几岁遇到想要相伴一生的人 以前听到这样的故事会觉得甜蜜 现在 看了身边的真实案例后只觉得可怜你还没有正式开始自己的社会生活 你就已经规划好自己的家庭工作了各有追求吧 ,2020-11-18,10.1918767787972,0,6,3,0
189,暮春秋色,2020-11-18,5.09850855959,0,1,0,0
74,🎂🍅🎊11.18🎊🍅🎂 ,2020-11-18,0.0,1,47,21,0
888,鸽了八百年了 ,2020-11-18,0.648584624669,0,0,2,0
888,才看到谁被吞了啊 ,2020-11-18,-1.4949612089121005,1,0,0,0
147,@我没有在抠脚 ,2020-11-18,-1.553610614793,1,0,0,1
597,#运动打卡# 148打卡…上一个21天计划做完了…新的机会怎么说呢比较随意我决定暂且做上一个月试试…固定燃脂运动+腹部或腿部…三个我最中意的部位直角肩是一如既往 ,2020-11-18,7.680370843845599,0,0,0,0
234,微醺。晚安。由衷觉得每个人都好可爱好闪光。也觉得生活大部分都挺苦偶尔有时候又挺甜，依旧是及时行乐得过且过努力奋进主义者。觉得大家都挺不容易。活着本身就好不容易，越来越理解每个人，理解这个世界的各式各样规则。爱这个世界有时候又会觉得无奈，无奈大部分都是因为自己的欲望，想要的太多，而行动和努力又没有让自己得到想要的。#日常叨逼叨#,2020-11-18,13.736776105382795,0,8,0,0
867,到了整天都睡不醒的季节。人多半是废了 ,2020-11-18,-4.446103569093,1,2,2,0
798,我为肖战超话贡献66影响力，超话目前在明星超话No.1！戳这里→网页链接 跟我一起助TA荣登超话封面吧~ ,2020-11-18,17.619893216311606,0,0,0,0
409,Never apologize for burning too brightly or collapsing into yourself every night. That is how galaxies are made. — Tyler Kent White.每天晚上明亮地或崩溃地进入自己。星系就是这样形成的。——泰勒肯特怀特。 ,2020-11-18,30.545985731690198,0,2,0,0
267,今天真的是冬天该有的温度嘛难以想象我家那边的叶子已经掉光了 南京·东南大学(九龙湖校区) ,2020-11-18,0.4896006645777001,0,0,0,0
481,我喜欢张继科这样的糙汉子 ,2020-11-18,3.8044194017917,0,1,0,0
481,焦糖色的秋天 ,2020-11-18,0.3988470204679999,0,1,0,0
481,沉溺bk的嗓音无法自拔 ,2020-11-18,2.295880937333,0,1,0,0
481,我的包容度真的很低，真的很容易生气，但我没错，也不会改 ,2020-11-18,-0.987944735841,1,1,0,0
23,今天我升级为VIP2了,2020-11-18,0.98297512732,0,0,0,0
370,分享单曲 The Scientist (@网易云音乐) ,2020-11-18,10.889522784230001,0,0,0,0
370,褪黑素可以再吃起来了Ծ‸Ծ ,2020-11-18,-0.487949289806,1,0,0,0
35,昨天学了这支 没学会 小趁ni的微博视频 ,2020-11-18,2.713389012752,0,0,0,0
900,完美一点才会有力量 邯郸·馆陶县 ,2020-11-18,3.3404703856230005,0,2,0,0
735,人人都是月亮：都有不曾向别人展示的阴暗面#冰秋# ,2020-11-18,7.1176726079289985,0,0,1,0
236,：医生低头时发现，牢牢地吸在自己的脚上#平价好物种草##马嘉祺# 合肥·锦湖家园 ,2020-11-18,1.8931959908390001,0,0,1,0
216,我跟美女搭不上邊、过程你让我怎么哭都行，唯有成為學霸 金华·联进村 ,2020-11-18,4.240058868385,0,0,0,0
138,多少时候！证明自己活得千姿百态：不想再硬凹姿态，你就懒得再为无关紧要的人、动用修图软件。#搞笑逗比集中营# 三门峡·卢氏县人民医院 ,2020-11-18,4.429674701458,0,1,1,0
931,连续被扇耳光。不时流离失所，【深圳合租记】羅志祥饰演的宋小雷因与本人强烈的反差令观众和粉丝惊喜连连[最右]#破云# 金华·上屋 ,2020-11-18,15.546269638893802,0,0,0,0
335,孙芮超话 💗#孙芮 璀璨不止仲夏# 啊啊啊啊啊啊啊啊啊啊啊啊啊我也心动了，第一次买应援服 ,2020-11-18,9.734214536858,0,3,0,0
300,找个精神支柱是不是好一点 ,2020-11-18,-0.38118346615800003,1,1,0,0
62,整个就是一个果丹皮 ,2020-11-18,-0.6785258093229001,1,1,0,0
612,但也有孤独的快乐。学会淡然接受……等待着心开始变的麻木：总会慢慢的等待愈合的伤口；心情会突然变的很差……想着自己是多么的孤独：一个人时。 ,2020-11-18,-0.8993240952625995,1,0,0,0
18,没有男朋友当壁纸但是我有姐妹呀！@我的新年愿望是大物高数线代不挂 ,2020-11-18,9.63297431392194,0,5,2,0
18,永远不要有那种奇奇怪怪的期待 ,2020-11-18,3.810526228138,0,3,2,0
268,最近弄勒卢什和夏布洛尔蓝光合集，多数像是法系、俄系压制资源，压制程度千奇百怪，有的简直可以说是把蓝光压成DVD画质。比较难办的是，少数几个只有一条俄字或什么字幕都没有，更有几个明明出了蓝光却无源流出（两位导演各有两三个是这样）。后来反应过来，其实他俩的资源还没洗到可以肆意整理合集的阶段，除非短时间内有厂牌直接出全集。看时间表，12月还有一套夏布洛尔小合集会慢悠悠洗出一部03年的《恶之花》（零几年的电影感觉都处于一种尴尬地位）。只能慢慢来。而且就算蓝光全了，字幕翻译也道长且阻（DVD时代中字又有另一个遗留问题）。想像刷戈达尔全集那样自由地看这二位的作品兴许还要等几年。（如果有大佬已经收集的差不多了，还请当我以上是班门弄斧，自娱自乐）,2020-11-18,17.961199828860398,0,4,3,0
526,在候诊区了，有一点控制不住自己的情绪 ,2020-11-18,-5.708099890352,1,0,0,0
904,现在走路也疼 ,2020-11-18,-4.925606482143,1,0,0,0
904,军训一点胃口都没有！ ,2020-11-18,-1.417128491641,1,0,0,0
862,【我是如何教训那个海归留学生的】1、前一阵微信群里有一个心理咨询师（女生，英国海归）给大家讲解一些心理健康方面的问题。2、刚开始我抱着听一听的态度，后面发现他竟然讲起了国学（四书五经，儒家等等），用这些来讲解现代心理学。关键讲的很一般。3、然后我发言了，我说：“坦白讲，我们之所以听你讲，是本着你是“中西兼学”的期待来的，如果你要讲国学，不好意思，我比你精通。”我接着说，你对英国文化了解吗？当地教堂去过几次？他们的信仰是如何塑造他们的性格的？你顶着“海归”的帽子，连当地人的信仰都不深入研究，回国来讲国学？4、我接着说，论中国文化，我比你精通；论西方文化，群里的虔诚基督徒比你精通。你的优势在哪里？你出国前、回国后想清楚了吗？5、我接着说：“我们想听的是西方的宗教、文化；而你出国给我们带回来的不是知识，而是一腔传统热情”。论传统文化，我们都比你懂！,2020-11-18,54.01314738895547,0,34,15,3
588,艹啊，连着在首页看到两次才知道是韩寒和李诞一起商业代言的软文。不过找这俩做共同代言真的有意思，立马拔高到时代风向 ,2020-11-18,7.0613853047385975,0,0,0,0
