user_id,raw_txt,txt_time,senti_value,label,dianzan,pinglun,zhuanfa
732,明白了，统稿就是干事的，非领导！ ,2020-11-11,1.411371627915,0,0,1,0
732,第一，2003年交书稿，当年就出版了？从交稿到出版，还有许多工作要做。书未出，主持人就走了？第二，说明中哪里有指定赵勤轩负责之词语？分工中，只参加两卷，而排名在后。这种人，可能是主持人？第三，统稿人排名在前，也不是主持人。统稿人就是统稿人，与主持人相差很远。第四，文选还有统稿人？赵勤轩写了？未，统稿个啥子？,2020-11-11,12.407749410006707,0,1,4,0
732,《粟裕文选》出版于2004年，有人说是2003年。呸！ ,2020-11-11,3.5171849544602005,0,0,1,0
732,《粟裕文选》编辑组的主持人，有叫赵勤轩的？有谁知道不？ ,2020-11-11,0.7998150902521999,0,0,1,0
539,只要不在意世界永远美丽你大概能看到那画面从你的电视机（@网易云音乐） ,2020-11-11,11.1833446457612,0,1,0,0
469,奇物共赏4好可爱的暖水袋啊 想要 ,2020-11-11,2.5488941332,0,0,4,0
469,好喜欢木匠啊！看他们做家具做厨具真的很治愈！ ,2020-11-11,4.2104752676698,0,0,1,0
373,冬日套餐 ,2020-11-11,3.80160955503,0,1,0,0
744,背叛是一件很累很长的事情要想成为适当的背叛者，就要注意小的事情。不然的话不做或不留下痕迹。#独立女性# 金华·沙溪 ,2020-11-11,9.509942813152405,0,0,1,0
183,杀青快乐🎬 南京·中国传媒大学南广学院 ,2020-11-11,8.072482814629,0,5,0,0
64,真就每次生病的时候都能闻到一股子生病的味道 ,2020-11-11,-5.083522958952,1,1,0,0
604,日常超话十一月是被食物包围的月份胃真的满足了炊烟的味道还是不错的蛋糕很好吃（璐璐生日快乐，许的愿望都实现）【很喜欢走在路上看大家来来往往，车从身边开过，喜欢感受市井生活的气息，喜欢烟火气，很容易就联想到了自己在b站看到纪录片人间喜事的一些片段】 ,2020-11-11,38.25076194934089,0,3,2,0
595,别把我的热情当成性格皮好吗我性格皮吗……我难道不是温柔安静那一挂吗 ,2020-11-11,-2.0801617070282,1,2,2,0
578,Burberry巴宝莉BBR 19FW羊毛针织毛衣开衫 模特上身图 ,2020-11-11,15.435360502529994,0,0,0,0
578,Burberry巴宝莉BBR 19FW羊毛针织毛衣开衫原版4600购入，1：1打版，定染纱线，采用14针日本进口岛精机制作而成，领口袖口全部按照原版宽度制作，细抠每一处小细节，口袋一体成型，1万颗起订的Logo纽扣，定制辅料洗水标，混卖版本Size：S-L ,2020-11-11,52.44809903020634,0,0,0,0
578,THE NORTH FACE MOUNTAIN DOWN JACKET机能防水羽绒服紫标加厚蓬松90白鸭绒 ykk原厂定制拉链市场 防水面料 进口机器刺绣工艺 一针一线都按照微米计算Size：S-XL ,2020-11-11,46.67296731614299,0,0,0,0
578,THE NORTH FACE MOUNTAIN DOWN JACKET机能防水羽绒服紫标加厚蓬松90白鸭绒 ykk原厂定制拉链市场 防水面料 进口机器刺绣工艺 一针一线都按照微米计算Size：S-XL ,2020-11-11,46.67296731614299,0,0,0,0
578,THE NORTH FACE MOUNTAIN DOWN JACKET机能防水羽绒服紫标加厚蓬松90白鸭绒 ykk原厂定制拉链市场 防水面料 进口机器刺绣工艺 一针一线都按照微米计算Size：S-XL ,2020-11-11,46.67296731614299,0,0,0,0
578,THE NORTH FACE MOUNTAIN DOWN JACKET机能防水羽绒服紫标加厚蓬松90白鸭绒 ykk原厂定制拉链市场 防水面料 进口机器刺绣工艺 一针一线都按照微米计算Size：S-XL ,2020-11-11,46.67296731614299,0,0,0,0
578,TNF x Brain Dead联名Denali Fleece抓绒拼色夹克  模特上身图 ,2020-11-11,9.1041763586439,0,0,0,0
578,TNF x Brain Dead联名Denali Fleece抓绒拼色夹克TNF与洛杉机艺术街 品牌BrainDead首度合作 联手开展一场思想探索的冒险之旅 以拥有悠久历史的品牌发源地加州柏克莱 为系列图案及色调配搭的设计灵感 面料采用定做定染加厚摇粒绒 五金拉链方面采用原色号YKK拉链 衣服的上半部分采用梭织功能性面料 具有一定的防撕裂功能 拉链的拉手部分采用尼龙织带 秋冬外穿或者打底都是不错的选择Size：S-XL,2020-11-11,115.17659355213335,0,0,0,0
578,EVISU福神 20AW 男士佛头刺绣飞行员夹克外套棉衣  模特上身图 ,2020-11-11,14.715060326368,0,0,0,0
578,EVISU福神 20AW 男士佛头刺绣飞行员夹克外套棉衣          这件军绿色MA-1飞行员外套背面绣上蓝绿拼色笔刷佛头、军事徽章和EVISU FORCE标语，正面以军事风小海鸥点缀，在便服设计上展示现代军事风格。搭配牛仔裤穿搭，走上街头吸引众人目光。Size:M-XXL ,2020-11-11,53.669226231337404,0,0,0,0
533,#光腿神器#七阿嬷深肤色不可，微发红 照片里看着还行现实生活中发红 ,2020-11-11,9.555064901933598,0,6,1,0
387,怕的是一直孤单，怕的是一错再错、...。 淮北·恩赐福 ,2020-11-11,0.8249023413353003,0,0,0,0
610,#石玺彤杀不死#等着我 我去给你俩搬民政局 ,2020-11-11,0.3268223646190001,0,10,0,1
450,明天考期中了，我崽说今天他后面的同学祈祷来着，祈祷达芬奇帮助自己考全班第三十二名。。我:？？这倒是一个对自己定位很准确的小孩！！ ,2020-11-11,3.8592667062935,0,0,0,0
450,vv好笑，看到有人说“他不去为什么不出来辟谣”，你有事儿么？谁说的话谁传的谣谁负责，你信的谁你找谁去啊，咋了以后路边的🐶 拉个屎都得他出来辟谣？？？这种言论我看到就好比:你老板给你说他打算明天给你发十万块钱，结果没发，你问他为啥不发，他自己说过的话他要负责后续解释。你们公司的竞争对手给你说他看到别人发的朋友q的聊天记录说你老板明天打算给你发十万块钱，你信了，第二天没发，你去问老板为啥不给你发，不发为啥不给你说一声。你老板是不是该扇你一嘴巴子了信谁的不行信心怀鬼胎的货，你信他你让他给你发钱去啊。,2020-11-11,-17.5231100567047,1,0,0,0
69,他们永远在那里远远地看着你，你不一定经常能看到他们。好朋友就像是星星。啥用没有；只要你一抬头……但你知道 池州·梅林东苑 ,2020-11-11,2.549318250346301,0,0,0,0
