user_id,raw_txt,txt_time,senti_value,label,dianzan,pinglun,zhuanfa
757,边听lecture边想: 这样的我真的可以毕业吗 ,2020-11-06,-1.7549520292866,1,0,0,0
757,以及确实，我可以看很多乱七八糟不知道干啥的论文，但不会点开任何一篇专业课必读😅 ,2020-11-06,-2.7693206567622,1,0,0,0
757,看了一个讲萩尾的大概有六十几页的论文，主要谈托马心脏，顺带把萩尾早年经历和当时立本社会情况也提了一嘴，前面看得津津有味因为谈了很多之前不知道的料宛如在看名人八卦（）到后面觉得很恐怖，写得太「可信」了，好像已经把萩尾扒光了的可信，因为没人知道真相究竟怎样看起来就更加「可信」。我很恨被解读，但活着就是要被无数人解读，很痛苦，到了一种如果当事人是我我宁愿死了之后再被人这样分析的程度。作者无疑很爱萩尾，爱她所以解读她，这样一说会觉得搞这方面学术蛮恶心，靠挖掘别人来获得自己的研究成就，被允许被嘉奖的stk。相应地想想，创作者就是地母，生产作品就罢了，还要打开自己供人开采，啊…想想世界上有多少万「搞学术的」（特指重点放在作者身上这类）在吸前人的血来暖自己的身子，顿时觉得更恶心了，尽管出发点是爱与尊敬，尽管确实有必要存在，它还是被美饰的自私,2020-11-06,7.7466019498635985,0,1,0,0
757,看见乙游纸片男跟动物说话我的感觉和看见紫薇跟马说话没啥区别。。 ,2020-11-06,-0.6874923644729002,1,0,0,0
616,跟所有的伤心，不快，恶意说拜拜吧@X玖少年团肖战DAYTOY ,2020-11-06,-0.13248218403499967,1,0,0,0
742,以咖会友，以及觥筹。 ,2020-11-06,2.1914947437347,0,43,12,0
891,【挖到中国去】游戏的主角是一个奇葩少年，或许是为了满足自己对打洞的癖好，想要打穿地底到对面去看看，特别是他搞怪的样子和打扮尤其有趣，让游戏充满喜感。#steam# 日照·米斯韦尔西餐厅(北京路店) ,2020-11-06,22.98008827616653,0,0,0,0
350,抖音极速版，邀请码85629891约翰·加尔通曾成功预言柏林墙倒塌和苏联解体，在本书中则预言美帝国将于2020年崩溃。《美帝国的崩溃》大的亮点，不仅在于对美帝国即将崩溃的惊世预言，更在于预言背后的严谨分析。作者以1980年预测苏联帝崩溃洞察世界政治的风云变幻    ,2020-11-06,11.435859448955304,0,2,7,0
350,番茄小说邀请码701010567雾氛笼罩着的白杨，丛密的矮树，细柳和果树，把根须浸在静寂而湍急的水流里，还有村落、教堂、果园懒洋洋地睁着好奇的眼睛俯视两岸；远远的，蓝色的七峰在天空画出严峻的侧影，上面矗立着废弃的古堡，显出一些瘦削而古怪的轮廓。 ,2020-11-06,28.29050985026579,0,1,7,0
350,快手极速版，邀请码 2xyj73m约翰·加尔通曾成功预言柏林墙倒塌和苏联解体，在本书中则预言美帝国将于2020年崩溃。《美帝国的崩溃》大的亮点，不仅在于对美帝国即将崩溃的惊世预言，更在于预言背后的严谨分析。作者以1980年预测苏联帝崩溃洞察世界政治的        ,2020-11-06,11.258951268316304,0,1,2,0
444,没有人会拒绝酒局 ,2020-11-06,-1.02506599287,1,9,2,0
224,偷偷发个vb想这个女人啦@Libreee- 滨州·滨州学院 ,2020-11-06,6.021464526716,0,15,0,0
790,我有预感，今天老公仔做得鸭不会很好吃。 ,2020-11-06,3.123003801347,0,0,0,0
790,想那个 ,2020-11-06,-0.900672204041,1,0,1,0
856,如果我能早点对你说出来！在两个人的爱情世界里！山野。用最具磁性的声音。心也就不再悲哀，穿透每个人的情感防线……“如果爱能早些说出来。#职业生涯规划##产后脱发# ,2020-11-06,2.6000314219552996,0,0,0,0
856,无穷尽的思念化作温柔……就能感到天荒地老的许诺、那种心境该是多么的美好！ 蚌埠·馨和宫 ,2020-11-06,7.588576090503699,0,0,0,0
254,可越是这样就越要让自己变的更强大更优秀……反而让小人得志……这些贱人为什么见不到你过得好，绞尽脑汁在背后使绊子害你诋毁你；因为他过的没你好！锤胸顿足改变不了什么、有些人就是抱着羡慕忌妒恨的态度活着 杭州·董家社区 ,2020-11-06,2.5728512077638,0,0,0,0
196,越有钱就穿的越少：神龙突然从天而降：”…… ,2020-11-06,-2.3850360638849,1,0,0,0
451,特别想写一本百合版的王子复仇记，就基督山伯爵那类的。老子想写爽文了！ ,2020-11-06,0.43916057792799934,0,36,18,0
451,网页链接俗烂小说更新！第四章更新了！她来了她来了😁 ,2020-11-06,3.3588943678200005,0,4,1,0
451,尼玛的，在看沙雕视频，伤口笑裂了我的快乐源泉没有了！ ,2020-11-06,2.260445861496001,0,6,0,0
