user_id,raw_txt,txt_time,senti_value,label,dianzan,pinglun,zhuanfa
724,桂林超话#手机里的桂林# 粉岩的红柿成熟了 ,2020-11-14,5.272848237017,0,1,0,0
804,スフレオムレツ和鹅肝怎么那么优秀啊 两个人吃得鬼喊鬼叫的。 日本·代々木上原 ,2020-11-14,4.686680013994,0,2,0,0
757,新家新视野 ,2020-11-14,2.029441618349,0,4,4,0
757,其实也不能说完全自己搬家 有好多善良的友友帮助了我感恩米娜桑 我在微博里说虽然🈚️人看得见 但确实是很感谢 ,2020-11-14,5.0398749961658,0,1,3,0
757,自己搬家后，我开始相信这世界上没什么是我做不到的了 ,2020-11-14,-0.6991843145195997,1,2,0,0
757,人 可以一个人搬家 ,2020-11-14,-1.00390419462,1,0,0,0
927,给@yzqtan 读读金阁寺造型 小王化妆 小羊发型 小柯摄影 小李助理 小拖 ,2020-11-14,8.371900106846999,0,18,1,1
927,蓝了又红了 ,2020-11-14,1.645538916147,0,25,6,0
927,近期艺术浓度太高 ,2020-11-14,1.62736240813,0,15,0,0
891,冒险者口袋里的冒险岛游戏！喜欢冒险的朋友们让你快点来。成为冒险者旅途中独一无二的冒险者吧！享受那里的冒险之梦吧！ 日照·沭河公园 ,2020-11-14,19.044737874231,0,0,0,0
592,今晚十二点刚过，隐约听到好像有烟花🎆的声音 从卧室光着脚慢慢朝阳台走了过去 眼前看到满满的烟花绽放。在这夏天的夜里 吹着晚风 看着围绕着全城几十簇的烟花在眼前同时绽放 瞬间心情舒爽开心。是要比得上在晚上的海边 吃冰吹风 然后手里提着鞋子光着脚踩在沙滩上慢悠悠听海风的时光了。 ,2020-11-14,13.987425754232733,0,3,2,0
714,太🈚了这一天天的 ,2020-11-14,-1.1339729867789998,1,18,6,0
714,呜呜呜吃到了妈妈寄来的腌的螃蟹 我活过来了 ,2020-11-14,-2.093358465799,1,2,2,0
350,高佣联盟，邀请码：29324803新人0元购该不该做副业，问自己3个问题：第一放下手中的工作，你还有收入吗？第二除去每月的开销，你还剩多少？第三如果遇到突发情况，没了工作收入，你还能应付吗？ 手机赚钱app分享商品 ,2020-11-14,12.069226490992,0,2,5,0
350,抖音极速版，邀请码85629891约翰·加尔通曾成功预言柏林墙倒塌和苏联解体，在本书中则预言美帝国将于2020年崩溃。《美帝国的崩溃》大的亮点，不仅在于对美帝国即将崩溃的惊世预言，更在于预言背后的严谨分析。作者以1980年预测苏联帝崩溃洞察世界政治的风云变幻    ,2020-11-14,11.435859448955304,0,4,5,0
444,五道口体育学院名不虚传2天一次运动频率开心开心 ,2020-11-14,7.1245462170675005,0,13,12,0
444,看自己之前写的东西真的好好笑 ,2020-11-14,-1.070186132782,1,9,4,0
444,周五例行🍻（说好的戒酒的） ,2020-11-14,4.947566645158,0,4,6,0
246,你就做你自己呗，有点奇怪没关系，和别人不一样也没关系。 ,2020-11-14,0.09684969723940018,0,3,1,0
777,脏脏的小乖，才一个月大的小可怜，因为还太小了没有办法打疫苗也没办法洗澡，只希望你茁壮成长哦 ,2020-11-14,-1.925045857286,1,2,0,0
763,早上好最近晚上睡得早早上也起不来一天起码睡十个钟头 ,2020-11-14,-5.446725281359299,1,65,35,0
856,我们彼此聚拢！切割、无论有多么起伏的剧情在身上上演：然后组成一个光芒四射的巨大玻璃球、重合……旋转。#修行# 蚌埠·吴家湾 ,2020-11-14,12.795654534275998,0,0,1,0
706,倾斜角度大的挡风玻璃有利于降低风阻，新车尾部采用运动化造型，【奥迪全新A5轿跑车谍照曝光】新车延续了奥迪品牌的最新设计语言，大量使用铝制装饰条，新车内饰借鉴全新A4的风格、枚红色Boyfriend风西装+针织包臀短裙+及膝长筒靴。回头一瞬间的惊艳、前进气隔栅造型犀利：金属气息浓重。使用了大尺寸进气口和棱角更加分明的头灯…… 鹤壁·曹家村,2020-11-14,66.3825405760563,0,0,0,0
196,是非常适合上班族的一个造型！以后我对你再也不抱任何幻想了……加色卡其色的九分裤和高领毛衣；咖啡色+卡其色+白色。看起来非常贵气且气质温婉，暖色调似乎会让穿的人看起来更加容易亲近；三个颜色拼起来非常和谐#盘它# ,2020-11-14,26.59986345763209,0,0,0,0
279,琴琴子和覃覃子去剪头发💇♀️ ,2020-11-14,1.312339454677,0,3,0,0
279,『纪念体育节一周』 ,2020-11-14,0.5383590074139999,0,3,0,0
451,我和别人的白月光在一起了 被渣之后第十二章它它它它它它更新了！！ 网页链接 ,2020-11-14,3.4462967528469997,0,4,0,0
451,啊，现实生活好无趣啊！刚在等车，脑海里全是卧轨转生梗！就想着一下穿越莽荒异世界成为蜥蜴人就好了！ ,2020-11-14,1.7459009603671998,0,11,3,0
451,砸锅卖铁去上学！真的好看！！妈的机甲那么可爱，你怎么能伤害机甲呢？？三三！砍他！！ ,2020-11-14,-2.067424227789,1,12,0,0
101,俺要练屁股呀！ ,2020-11-14,-1.618354369202,1,0,0,1
101,连着喝了一个月的烧仙草，书亦，真有你的！ ,2020-11-14,0.4074444721489999,0,0,0,0
101,最近真的好开心哦，这几个月都很少发牢骚 ,2020-11-14,-2.146256018044,1,0,0,0
101,小宝贝今天五岁咯 ,2020-11-14,1.4160644718259998,0,0,0,0
