user_id,raw_txt,txt_time,senti_value,label,dianzan,pinglun,zhuanfa
616,壁纸壁纸，好看死了#肖战# ,2020-10-07,6.57980086456,0,0,0,0
616,#肖战# 我爱你我爱你我爱你我爱你我爱你！！！你很好你超好你极好，肖战你好到无与伦比@X玖少年团肖战DAYTOY ,2020-10-07,8.58795415566,0,0,0,0
927,那是一个妙不可言的四月：在春天和她一起睡觉，在春天和她一起吃饭，在春天和她散步，在春天和她旅行，看着她——入迷地看着她——她穿着春天的衣裳。 ,2020-10-07,19.523770693455106,0,39,0,3
490,到底得到什么才让我觉得现在承担的这一切值得。无论得到什么都不会让我觉得这一切痛苦值得。 ,2020-10-07,0.68153683878,0,1,0,0
350,不迎合他人，不委屈自己，不指使别人，不受人使唤道不同，不相为谋路相异，趁早别过与谁同坐明月 清风 我 ,2020-10-07,-0.7606992868170002,1,6,4,0
350,世人匆匆忙忙只为碎银几两叹兮 ,2020-10-07,0.29938594721,0,4,4,0
911,众相渡他｜2020肖战原创生贺曲 UP主: 老坛酸辣仙#bilibili# 众相渡他｜2020肖战原创生贺曲 (哔哩哔哩客户端下载 网页链接) ,2020-10-07,30.302799843558997,0,0,1,0
763,上条微博不小心删了今天更个小小吃货的日常热可可真的很适合降温的秋天 ,2020-10-07,3.2107579604320002,0,60,37,0
224,快乐到底是什么？ 滨州·滨州学院 ,2020-10-07,7.222610297981,0,5,1,0
790,室友被理发店拉客做头发，其实就是剪头而已，中途莫名其妙上了点药水，但没有加热拉直染烫等替他操作，最后莫名其妙连哄带骗被动花了八百多。她一个人去的，毕竟头发做完了，也只能不情愿地付了钱。我很理解她，在那种氛围下，谁不想做体面的女大学生，谁不想从容地捏好自己的自尊心发誓再也不来此地半步并安慰自己忘了这糟心的事吧。我完全理解她的困境。（咨询学法的同学也是认为此事没什么好办法）她叫我和另一个室友明天陪她去跟理发师理论理论，要么退一部分钱，要么再附赠染烫什么的。虽然我也觉得没什么用，但我看到善良温柔的人被这样欺负还是觉得好生气，一定要帮她说出不满。而且她能决定再回去一次去为自己讨要说法我觉得已经很勇敢很不错了。我不会对她说，没用的你就当踩狗屎了这种话，因为生活中狗屎太多了，踩到的概率太大了，接受狗屎就是在合理化这个世界的不合理处（嘿嘿又女子大生发言了总之还是觉得女生一定要学会拒绝，就算不会拒绝也要学会冷漠，用冷漠来拒绝。别人的话觉得不舒服不合理了小声反驳一下也比默默忍受要好一些。最好能降低一下自我道德标准，因为很多人对付女孩最喜欢情感勒索和道德绑架。“帮帮忙嘛，我们也不容易”“其实谁都不容易”“你不要不让人把话说嘛”“如果你说完我能反对那你就说”“小姐姐笑起来真有感染力，你买几根也行啊”“不，不行，对不起。”就这种攻击性不算强的话一定要学着说，否则真的会很痛苦很难过，不要承担这些不属于你的负担好吗？,2020-10-07,-44.81018398998921,1,9,1,1
790,不是吧，wb咋做到一夹一个准的 ,2020-10-07,0.08849436796199994,0,1,5,0
790,好想嗑瓜子嗑一晚上 ,2020-10-07,-2.561433946997,1,0,0,0
790,随手搞 ,2020-10-07,-0.09014497970000004,1,9,0,0
555,不要成为一个一换季就感冒的笨蛋🤧 青岛 ,2020-10-07,-0.8798741051348001,1,0,0,0
856,我们结婚吧。记住！因为后面还有一群人在等着看你的笑话……但至少我会对我好的人好、“没关系……可以哭，但是不可以不坚强；我不完美…… 蚌埠·五河县 ,2020-10-07,0.13631875771420016,0,0,0,0
279,三天没出门，都不知道现在猴年马月了，这冷风嗖嗖的，差点没给我送走。 ,2020-10-07,-5.748416686576,1,0,0,0
451,在重温犬夜叉，桔梗一出来，党争四起。我就不一样了，心心念念百合水仙给我发糖(蹲 ,2020-10-07,6.06068626066,0,26,3,0
451,向东流广播剧超话我来看看，今天有没有读者朋友给我发剧评呢。(敲碗等 ,2020-10-07,4.7388991958030005,0,11,3,0
101,你就不能哄哄我 ,2020-10-07,0.0,1,0,0,0
